<?xml version="1.0" encoding="UTF-8" standalone="yes"?>
<rdmRelease xmlns:xsi="http://www.w3.org/2001/XMLSchema-instance" xsi:noNamespaceSchemaLocation="rdm_release_schema.xsd">
  <paket lieferkanal="focus360">
	<releasetyp>${releasetyp}</releasetyp>
	<verteilungstyp>${verteilungstyp}</verteilungstyp>
	<version>${project.version}</version>
	<releaseschein>KIEL</releaseschein>
	<vorgaengerpaket>${vorgaengerpaket}</vorgaengerpaket>
	<lieferdatum>${lieferdatum}</lieferdatum>
	<liefergegenstaende>
	  <artefakt id="focus.frontend" />
	  <artefakt id="focus.db" />
	  <artefakt id="focus.install.manual" />
	  <artefakt id="focus.release.notes" />
	</liefergegenstaende>
	<workflows>
	  <workflow id="focus.workflow.lieferung" />
	</workflows>
  </paket>
</rdmRelease>

